{
  "$schema": "https://json-schema.org/draft/2020-12/schema",
  "title": "AgentCompletion Run Cost Log",
  "type": "object",
  "required": [
    "run_id",
    "task_id",
    "started_at",
    "ended_at",
    "model_name",
    "prompt_variant",
    "stop_reason"
  ],
  "properties": {
    "run_id": { "type": "string" },
    "task_id": { "type": "string" },
    "started_at": { "type": "string" },
    "ended_at": { "type": "string" },
    "model_name": { "type": "string" },
    "prompt_variant": { "type": "string" },
    "input_tokens": { "type": ["integer", "null"], "minimum": 0 },
    "output_tokens": { "type": ["integer", "null"], "minimum": 0 },
    "tool_calls": { "type": ["integer", "null"], "minimum": 0 },
    "wall_clock_seconds": { "type": ["number", "null"], "minimum": 0 },
    "stop_reason": { "type": "string" },
    "notes": { "type": ["string", "null"] }
  },
  "additionalProperties": true
}
