{
  "run_id": "T4_SUM_union_preserving_autodl_seed03",
  "task_id": "T4_real_repo_click_deprecation",
  "started_at": "2026-06-08T08:48:44.686915+00:00",
  "ended_at": "2026-06-08T08:49:30.922183+00:00",
  "model_name": "gpt-5.3-codex",
  "prompt_variant": "autodl_union_preserving",
  "input_tokens": 4824,
  "output_tokens": 5544,
  "tool_calls": null,
  "wall_clock_seconds": 46.23524339997675,
  "stop_reason": "api_response",
  "notes": null
}