{
  "run_id": "T5_seed03_sum_standard_autodl",
  "task_id": "T5_real_repo_requests_tls_audit",
  "started_at": "2026-06-08T14:41:40.194367+00:00",
  "ended_at": "2026-06-08T14:42:19.060173+00:00",
  "model_name": "gpt-5.3-codex",
  "prompt_variant": "autodl_standard",
  "input_tokens": 9259,
  "output_tokens": 5119,
  "tool_calls": null,
  "wall_clock_seconds": 38.86559869998018,
  "stop_reason": "api_response",
  "notes": null
}